    1   0.000000 10.250.20.145 → 18.215.66.244 TLSv1.2 128 Application Data
    2   0.066822 18.215.66.244 → 10.250.20.145 TLSv1.2 137 Application Data
    3   0.066889 10.250.20.145 → 18.215.66.244 TCP 66 57370 → 443 [ACK] Seq=63 Ack=64 Win=2047 Len=0 TSval=114419465 TSecr=42508010
    4   0.133266 10.250.20.145 → 18.215.66.244 TLSv1.2 128 Application Data
    5   0.163454 18.215.66.244 → 10.250.20.145 TLSv1.2 137 Application Data
    6   0.163513 10.250.20.145 → 18.215.66.244 TCP 66 57371 → 443 [ACK] Seq=63 Ack=64 Win=2047 Len=0 TSval=114419561 TSecr=110906466
    7   0.573980 10.250.20.145 → 68.183.248.166 TCP 78 57689 → 443 [SYN] Seq=0 Win=65535 Len=0 MSS=1460 WS=64 TSval=114419971 TSecr=0 SACK_PERM=1
    8   0.642753 68.183.248.166 → 10.250.20.145 TCP 82 443 → 57689 [SYN, ACK] Seq=0 Ack=1 Win=28960 Len=0 MSS=1386 SACK_PERM=1 TSval=769124836 TSecr=114419971 WS=128
    9   0.642815 10.250.20.145 → 68.183.248.166 TCP 66 57689 → 443 [ACK] Seq=1 Ack=1 Win=131904 Len=0 TSval=114420039 TSecr=769124836
   10   0.651306 10.250.20.145 → 68.183.248.166 TLSv1 583 Client Hello
   11   0.713748 68.183.248.166 → 10.250.20.145 TCP 74 443 → 57689 [ACK] Seq=1 Ack=518 Win=30080 Len=0 TSval=769124908 TSecr=114420047
   12   0.716153 68.183.248.166 → 10.250.20.145 TLSv1.2 1448 Server Hello
   13   0.716762 68.183.248.166 → 10.250.20.145 TLSv1.2 1448 Certificate [TCP segment of a reassembled PDU]
   14   0.716793 10.250.20.145 → 68.183.248.166 TCP 66 57689 → 443 [ACK] Seq=518 Ack=2749 Win=129664 Len=0 TSval=114420110 TSecr=769124909
   15   0.717183 68.183.248.166 → 10.250.20.145 TLSv1.2 332 Server Key Exchange, Server Hello Done
   16   0.717206 10.250.20.145 → 68.183.248.166 TCP 66 57689 → 443 [ACK] Seq=518 Ack=3007 Win=130688 Len=0 TSval=114420111 TSecr=769124909
   17   0.717597 10.250.20.145 → 68.183.248.166 TLSv1.2 192 Client Key Exchange, Change Cipher Spec, Encrypted Handshake Message
   18   0.719655 10.250.20.145 → 18.215.66.244 TLSv1.2 129 Application Data
   19   0.749488 18.215.66.244 → 10.250.20.145 TLSv1.2 137 Application Data
   20   0.749590 10.250.20.145 → 18.215.66.244 TCP 66 57382 → 443 [ACK] Seq=64 Ack=64 Win=2047 Len=0 TSval=114420142 TSecr=77610866
   21   0.782026 68.183.248.166 → 10.250.20.145 TLSv1.2 125 Change Cipher Spec, Encrypted Handshake Message
   22   0.782131 10.250.20.145 → 68.183.248.166 TCP 66 57689 → 443 [ACK] Seq=644 Ack=3058 Win=131008 Len=0 TSval=114420174 TSecr=769124975
   23   0.783150 10.250.20.145 → 68.183.248.166 TLSv1.2 563 Application Data
   24   0.783168 10.250.20.145 → 68.183.248.166 TLSv1.2 550 Application Data
   25   0.849836 68.183.248.166 → 10.250.20.145 TCP 74 443 → 57689 [ACK] Seq=3058 Ack=1625 Win=32256 Len=0 TSval=769125039 TSecr=114420174
   26   0.852979 10.250.20.145 → 18.215.66.244 TLSv1.2 129 Application Data
   27   0.880709 18.215.66.244 → 10.250.20.145 TLSv1.2 137 Application Data
   28   0.880779 10.250.20.145 → 18.215.66.244 TCP 66 57384 → 443 [ACK] Seq=64 Ack=64 Win=2047 Len=0 TSval=114420271 TSecr=42508214
   29   0.888888 68.183.248.166 → 10.250.20.145 TLSv1.2 686 Application Data
   30   0.889000 10.250.20.145 → 68.183.248.166 TCP 66 57689 → 443 [ACK] Seq=1625 Ack=3670 Win=130432 Len=0 TSval=114420279 TSecr=769125082
   31   0.893903 10.250.20.145 → 68.183.248.166 TCP 66 57689 → 443 [FIN, ACK] Seq=1625 Ack=3670 Win=131072 Len=0 TSval=114420283 TSecr=769125082
   32   0.956833 68.183.248.166 → 10.250.20.145 TCP 74 443 → 57689 [FIN, ACK] Seq=3670 Ack=1626 Win=32256 Len=0 TSval=769125151 TSecr=114420283
   33   0.956896 10.250.20.145 → 68.183.248.166 TCP 66 57689 → 443 [ACK] Seq=1626 Ack=3671 Win=131072 Len=0 TSval=114420346 TSecr=769125151
   34   0.995536 10.250.20.145 → 18.215.66.244 TLSv1.2 129 Application Data
   35   1.026477 18.215.66.244 → 10.250.20.145 TLSv1.2 137 Application Data
   36   1.026581 10.250.20.145 → 18.215.66.244 TCP 66 57385 → 443 [ACK] Seq=64 Ack=64 Win=2047 Len=0 TSval=114420414 TSecr=98304565
   37   1.128168 10.250.20.145 → 18.215.66.244 TLSv1.2 129 Application Data
   38   1.155642 18.215.66.244 → 10.250.20.145 TLSv1.2 137 Application Data
   39   1.155747 10.250.20.145 → 18.215.66.244 TCP 66 57386 → 443 [ACK] Seq=64 Ack=64 Win=2047 Len=0 TSval=114420542 TSecr=42508282
   40   1.269397 10.250.20.145 → 18.215.66.244 TLSv1.2 129 Application Data
   41   1.300033 18.215.66.244 → 10.250.20.145 TLSv1.2 137 Application Data
   42   1.300135 10.250.20.145 → 18.215.66.244 TCP 66 57387 → 443 [ACK] Seq=64 Ack=64 Win=2047 Len=0 TSval=114420685 TSecr=76707861
   43   1.401609 10.250.20.145 → 18.215.66.244 TLSv1.2 129 Application Data
   44   1.444708 18.215.66.244 → 10.250.20.145 TLSv1.2 137 Application Data
   45   1.444822 10.250.20.145 → 18.215.66.244 TCP 66 57388 → 443 [ACK] Seq=64 Ack=64 Win=2047 Len=0 TSval=114420829 TSecr=21808460
   46   2.286262 10.250.20.145 → 65.55.44.109 TCP 78 57690 → 443 [SYN] Seq=0 Win=65535 Len=0 MSS=1460 WS=64 TSval=114421669 TSecr=0 SACK_PERM=1
   47   2.325619 65.55.44.109 → 10.250.20.145 TCP 82 443 → 57690 [SYN, ACK] Seq=0 Ack=1 Win=8192 Len=0 MSS=1386 WS=256 SACK_PERM=1 TSval=194195444 TSecr=114421669
   48   2.325697 10.250.20.145 → 65.55.44.109 TCP 66 57690 → 443 [ACK] Seq=1 Ack=1 Win=131904 Len=0 TSval=114421708 TSecr=194195444
   49   2.325921 10.250.20.145 → 65.55.44.109 TLSv1 267 Client Hello
   50   2.360925 65.55.44.109 → 10.250.20.145 TCP 1448 [TCP segment of a reassembled PDU]
   51   2.361142 65.55.44.109 → 10.250.20.145 TCP 1448 443 → 57690 [ACK] Seq=1375 Ack=202 Win=262400 Len=1374 TSval=194195480 TSecr=114421708 [TCP segment of a reassembled PDU]
   52   2.361182 10.250.20.145 → 65.55.44.109 TCP 66 57690 → 443 [ACK] Seq=202 Ack=2749 Win=129664 Len=0 TSval=114421743 TSecr=194195480
   53   2.361501 65.55.44.109 → 10.250.20.145 TLSv1.2 964 Server Hello, Certificate, Server Key Exchange, Server Hello Done
   54   2.361532 10.250.20.145 → 65.55.44.109 TCP 66 57690 → 443 [ACK] Seq=202 Ack=3639 Win=130176 Len=0 TSval=114421743 TSecr=194195480
   55   2.362340 10.250.20.145 → 65.55.44.109 TLSv1.2 159 Client Key Exchange, Change Cipher Spec, Encrypted Handshake Message
   56   2.395409 65.55.44.109 → 10.250.20.145 TLSv1.2 125 Change Cipher Spec, Encrypted Handshake Message
   57   2.395474 10.250.20.145 → 65.55.44.109 TCP 66 57690 → 443 [ACK] Seq=295 Ack=3690 Win=131008 Len=0 TSval=114421776 TSecr=194195512
   58   2.396517 10.250.20.145 → 65.55.44.109 TLSv1.2 1440 Application Data
   59   2.396519 10.250.20.145 → 65.55.44.109 TLSv1.2 382 Application Data
   60   2.524363 ExtremeNetworks_9e:3d:1c → Apple_97:dc:6e ARP 68 Who has 10.250.20.145? Tell 10.250.16.1
   61   2.524412 Apple_97:dc:6e → ExtremeNetworks_9e:3d:1c ARP 42 10.250.20.145 is at f0:18:98:97:dc:6e
   62   2.526337 65.55.44.109 → 10.250.20.145 TLSv1.2 389 Application Data
   63   2.526388 10.250.20.145 → 65.55.44.109 TCP 66 57690 → 443 [ACK] Seq=1985 Ack=4006 Win=130752 Len=0 TSval=114421906 TSecr=194195621
   64   2.526903 10.250.20.145 → 65.55.44.109 TLSv1.2 97 Encrypted Alert
   65   2.527041 10.250.20.145 → 65.55.44.109 TCP 66 57690 → 443 [FIN, ACK] Seq=2016 Ack=4006 Win=131072 Len=0 TSval=114421906 TSecr=194195621
   66   2.559867 65.55.44.109 → 10.250.20.145 TCP 74 443 → 57690 [ACK] Seq=4006 Ack=2017 Win=262400 Len=0 TSval=194195679 TSecr=114421906
   67   3.118674 18.215.66.244 → 10.250.20.145 TLSv1.2 1100 Application Data
   68   3.118774 10.250.20.145 → 18.215.66.244 TCP 66 57386 → 443 [ACK] Seq=64 Ack=1090 Win=2031 Len=0 TSval=114422496 TSecr=42508752
   69   4.352497 10.250.20.145 → 18.215.66.244 TLSv1.2 131 Application Data
   70   4.352881 10.250.20.145 → 18.215.66.244 TLSv1.2 131 Application Data
   71   4.353285 10.250.20.145 → 18.215.66.244 TLSv1.2 131 Application Data
   72   4.353682 10.250.20.145 → 18.215.66.244 TLSv1.2 131 Application Data
   73   4.354081 10.250.20.145 → 18.215.66.244 TLSv1.2 131 Application Data
   74   4.354482 10.250.20.145 → 18.215.66.244 TLSv1.2 131 Application Data
   75   4.355953 10.250.20.145 → 18.215.66.244 TLSv1.2 131 Application Data
   76   4.356358 10.250.20.145 → 18.215.66.244 TLSv1.2 131 Application Data
   77   4.424088 18.215.66.244 → 10.250.20.145 TCP 74 443 → 57387 [ACK] Seq=64 Ack=129 Win=9 Len=0 TSval=76708643 TSecr=114423730
   78   4.424566 18.215.66.244 → 10.250.20.145 TCP 74 443 → 57382 [ACK] Seq=64 Ack=129 Win=8 Len=0 TSval=77611785 TSecr=114423732
   79   4.425065 18.215.66.244 → 10.250.20.145 TCP 74 443 → 57385 [ACK] Seq=64 Ack=129 Win=8 Len=0 TSval=98305415 TSecr=114423730
   80   4.425515 18.215.66.244 → 10.250.20.145 TCP 74 443 → 57384 [ACK] Seq=64 Ack=129 Win=8 Len=0 TSval=42509100 TSecr=114423732
   81   4.425521 18.215.66.244 → 10.250.20.145 TCP 74 443 → 57386 [ACK] Seq=1090 Ack=129 Win=8 Len=0 TSval=42509100 TSecr=114423730
   82   4.426162 18.215.66.244 → 10.250.20.145 TCP 74 443 → 57371 [ACK] Seq=64 Ack=128 Win=8 Len=0 TSval=110907532 TSecr=114423729
   83   4.428682 18.215.66.244 → 10.250.20.145 TCP 74 443 → 57370 [ACK] Seq=64 Ack=128 Win=8 Len=0 TSval=42509101 TSecr=114423729
   84   4.438580 18.215.66.244 → 10.250.20.145 TCP 74 443 → 57388 [ACK] Seq=64 Ack=129 Win=8 Len=0 TSval=21809209 TSecr=114423729
   85   5.366033 10.250.20.145 → 64.233.185.189 UDP 65 50740 → 443 Len=23
   86   5.370466 64.233.185.189 → 10.250.20.145 UDP 70 443 → 50740 Len=20
   87   5.680566 18.215.66.244 → 10.250.20.145 TLSv1.2 1100 Application Data
   88   5.680619 10.250.20.145 → 18.215.66.244 TCP 66 57384 → 443 [ACK] Seq=129 Ack=1090 Win=2031 Len=0 TSval=114425053 TSecr=42509408
   89  10.000915 10.250.20.145 → 18.215.66.244 TLSv1.2 129 Application Data
   90  10.037841 18.215.66.244 → 10.250.20.145 TCP 74 443 → 57370 [ACK] Seq=64 Ack=191 Win=8 Len=0 TSval=42510503 TSecr=114429371
   91  10.040620 18.215.66.244 → 10.250.20.145 TLSv1.2 137 Application Data
   92  10.040665 10.250.20.145 → 18.215.66.244 TCP 66 57370 → 443 [ACK] Seq=191 Ack=127 Win=2047 Len=0 TSval=114429409 TSecr=42510504
   93  10.133445 10.250.20.145 → 18.215.66.244 TLSv1.2 129 Application Data
   94  10.162025 18.215.66.244 → 10.250.20.145 TCP 74 443 → 57371 [ACK] Seq=64 Ack=191 Win=8 Len=0 TSval=110908965 TSecr=114429501
   95  10.163422 18.215.66.244 → 10.250.20.145 TLSv1.2 137 Application Data
   96  10.163506 10.250.20.145 → 18.215.66.244 TCP 66 57371 → 443 [ACK] Seq=191 Ack=127 Win=2047 Len=0 TSval=114429530 TSecr=110908966
   97  10.719982 10.250.20.145 → 18.215.66.244 TLSv1.2 129 Application Data
   98  10.754778 18.215.66.244 → 10.250.20.145 TCP 74 443 → 57382 [ACK] Seq=64 Ack=192 Win=8 Len=0 TSval=77613367 TSecr=114430085
   99  10.755633 18.215.66.244 → 10.250.20.145 TLSv1.2 137 Application Data
  100  10.755669 10.250.20.145 → 18.215.66.244 TCP 66 57382 → 443 [ACK] Seq=192 Ack=127 Win=2047 Len=0 TSval=114430119 TSecr=77613367
  101  10.851765 10.250.20.145 → 18.215.66.244 TLSv1.2 129 Application Data
  102  10.878285 18.215.66.244 → 10.250.20.145 TCP 74 443 → 57384 [ACK] Seq=1090 Ack=192 Win=8 Len=0 TSval=42510713 TSecr=114430215
  103  10.995223 10.250.20.145 → 18.215.66.244 TLSv1.2 129 Application Data
  104  11.024066 18.215.66.244 → 10.250.20.145 TCP 74 443 → 57385 [ACK] Seq=64 Ack=192 Win=8 Len=0 TSval=98307065 TSecr=114430356
  105  11.026326 18.215.66.244 → 10.250.20.145 TLSv1.2 137 Application Data
  106  11.026417 10.250.20.145 → 18.215.66.244 TCP 66 57385 → 443 [ACK] Seq=192 Ack=127 Win=2047 Len=0 TSval=114430386 TSecr=98307065
  107  11.054858 18.215.66.244 → 10.250.20.145 TLSv1.2 137 Application Data
  108  11.054954 10.250.20.145 → 18.215.66.244 TCP 66 57384 → 443 [ACK] Seq=192 Ack=1153 Win=2047 Len=0 TSval=114430414 TSecr=42510757
  109  11.128215 10.250.20.145 → 18.215.66.244 TLSv1.2 129 Application Data
  110  11.154972 18.215.66.244 → 10.250.20.145 TCP 74 443 → 57386 [ACK] Seq=1090 Ack=192 Win=8 Len=0 TSval=42510782 TSecr=114430487
  111  11.155981 18.215.66.244 → 10.250.20.145 TLSv1.2 137 Application Data
  112  11.156070 10.250.20.145 → 18.215.66.244 TCP 66 57386 → 443 [ACK] Seq=192 Ack=1153 Win=2047 Len=0 TSval=114430514 TSecr=42510782
  113  11.269473 10.250.20.145 → 18.215.66.244 TLSv1.2 129 Application Data
  114  11.298454 18.215.66.244 → 10.250.20.145 TCP 74 443 → 57387 [ACK] Seq=64 Ack=192 Win=9 Len=0 TSval=76710361 TSecr=114430627
  115  11.299722 18.215.66.244 → 10.250.20.145 TLSv1.2 137 Application Data
  116  11.299816 10.250.20.145 → 18.215.66.244 TCP 66 57387 → 443 [ACK] Seq=192 Ack=127 Win=2047 Len=0 TSval=114430657 TSecr=76710361
  117  11.401600 10.250.20.145 → 18.215.66.244 TLSv1.2 129 Application Data
  118  11.442920 18.215.66.244 → 10.250.20.145 TCP 74 443 → 57388 [ACK] Seq=64 Ack=192 Win=8 Len=0 TSval=21810960 TSecr=114430758
  119  11.445536 18.215.66.244 → 10.250.20.145 TLSv1.2 137 Application Data
  120  11.445629 10.250.20.145 → 18.215.66.244 TCP 66 57388 → 443 [ACK] Seq=192 Ack=127 Win=2047 Len=0 TSval=114430801 TSecr=21810960
  121  14.690954 18.215.66.244 → 10.250.20.145 TLSv1.2 1098 Application Data
  122  14.691053 10.250.20.145 → 18.215.66.244 TCP 66 57388 → 443 [ACK] Seq=192 Ack=1151 Win=2032 Len=0 TSval=114434043 TSecr=21811756
  123  20.000085 10.250.20.145 → 18.215.66.244 TLSv1.2 129 Application Data
  124  20.039534 18.215.66.244 → 10.250.20.145 TLSv1.2 137 Application Data
  125  20.039615 10.250.20.145 → 18.215.66.244 TCP 66 57370 → 443 [ACK] Seq=254 Ack=190 Win=2047 Len=0 TSval=114439389 TSecr=42513003
  126  20.133503 10.250.20.145 → 18.215.66.244 TLSv1.2 129 Application Data
  127  20.163451 18.215.66.244 → 10.250.20.145 TLSv1.2 137 Application Data
  128  20.163532 10.250.20.145 → 18.215.66.244 TCP 66 57371 → 443 [ACK] Seq=254 Ack=190 Win=2047 Len=0 TSval=114439512 TSecr=110911466
  129  20.268330 64.233.185.189 → 10.250.20.145 UDP 89 443 → 50740 Len=39
  130  20.269358 10.250.20.145 → 64.233.185.189 UDP 70 50740 → 443 Len=28
  131  20.719615 10.250.20.145 → 18.215.66.244 TLSv1.2 129 Application Data
  132  20.755979 18.215.66.244 → 10.250.20.145 TLSv1.2 137 Application Data
  133  20.756088 10.250.20.145 → 18.215.66.244 TCP 66 57382 → 443 [ACK] Seq=255 Ack=190 Win=2047 Len=0 TSval=114440103 TSecr=77615867
  134  20.853036 10.250.20.145 → 18.215.66.244 TLSv1.2 129 Application Data
  135  20.879717 18.215.66.244 → 10.250.20.145 TCP 74 443 → 57384 [ACK] Seq=1153 Ack=255 Win=8 Len=0 TSval=42513213 TSecr=114440199
  136  20.880954 18.215.66.244 → 10.250.20.145 TLSv1.2 137 Application Data
  137  20.881049 10.250.20.145 → 18.215.66.244 TCP 66 57384 → 443 [ACK] Seq=255 Ack=1216 Win=2047 Len=0 TSval=114440226 TSecr=42513214
  138  20.995628 10.250.20.145 → 18.215.66.244 TLSv1.2 129 Application Data
  139  21.063208 18.215.66.244 → 10.250.20.145 TLSv1.2 137 Application Data
  140  21.063322 10.250.20.145 → 18.215.66.244 TCP 66 57385 → 443 [ACK] Seq=255 Ack=190 Win=2047 Len=0 TSval=114440406 TSecr=98309574
  141  21.128194 10.250.20.145 → 18.215.66.244 TLSv1.2 129 Application Data
  142  21.155716 18.215.66.244 → 10.250.20.145 TLSv1.2 137 Application Data
  143  21.155830 10.250.20.145 → 18.215.66.244 TCP 66 57386 → 443 [ACK] Seq=255 Ack=1216 Win=2047 Len=0 TSval=114440497 TSecr=42513282
  144  21.269485 10.250.20.145 → 18.215.66.244 TLSv1.2 129 Application Data
  145  21.300144 18.215.66.244 → 10.250.20.145 TLSv1.2 137 Application Data
  146  21.300238 10.250.20.145 → 18.215.66.244 TCP 66 57387 → 443 [ACK] Seq=255 Ack=190 Win=2047 Len=0 TSval=114440640 TSecr=76712861
  147  21.401699 10.250.20.145 → 18.215.66.244 TLSv1.2 129 Application Data
  148  21.446011 18.215.66.244 → 10.250.20.145 TLSv1.2 137 Application Data
  149  21.446116 10.250.20.145 → 18.215.66.244 TCP 66 57388 → 443 [ACK] Seq=255 Ack=1214 Win=2047 Len=0 TSval=114440785 TSecr=21813460
  150  22.684207 10.250.20.145 → 35.201.97.85 TLSv1.2 102 Application Data
  151  22.692842 35.201.97.85 → 10.250.20.145 TCP 74 443 → 57412 [ACK] Seq=1 Ack=37 Win=253 Len=0 TSval=917325418 TSecr=114442022
  152  23.906863 ExtremeNetworks_9e:3d:1c → Apple_97:dc:6e ARP 68 10.250.16.1 is at 02:04:96:9e:3d:1c
  153  24.359567 10.250.20.145 → 18.215.66.244 TLSv1.2 131 Application Data
  154  24.360075 10.250.20.145 → 18.215.66.244 TLSv1.2 131 Application Data
  155  24.360491 10.250.20.145 → 18.215.66.244 TLSv1.2 131 Application Data
  156  24.360895 10.250.20.145 → 18.215.66.244 TLSv1.2 131 Application Data
  157  24.361293 10.250.20.145 → 18.215.66.244 TLSv1.2 131 Application Data
  158  24.361683 10.250.20.145 → 18.215.66.244 TLSv1.2 131 Application Data
  159  24.363064 10.250.20.145 → 18.215.66.244 TLSv1.2 131 Application Data
  160  24.363463 10.250.20.145 → 18.215.66.244 TLSv1.2 131 Application Data
  161  24.431987 18.215.66.244 → 10.250.20.145 TCP 74 443 → 57387 [ACK] Seq=190 Ack=320 Win=9 Len=0 TSval=76713645 TSecr=114443696
  162  24.432012 18.215.66.244 → 10.250.20.145 TCP 74 443 → 57382 [ACK] Seq=190 Ack=320 Win=8 Len=0 TSval=77616787 TSecr=114443698
  163  24.432441 18.215.66.244 → 10.250.20.145 TCP 74 443 → 57386 [ACK] Seq=1216 Ack=320 Win=8 Len=0 TSval=42514102 TSecr=114443696
  164  24.432867 18.215.66.244 → 10.250.20.145 TCP 74 443 → 57384 [ACK] Seq=1216 Ack=320 Win=8 Len=0 TSval=42514102 TSecr=114443698
  165  24.432874 18.215.66.244 → 10.250.20.145 TCP 74 443 → 57385 [ACK] Seq=190 Ack=320 Win=8 Len=0 TSval=98310417 TSecr=114443696
  166  24.434080 18.215.66.244 → 10.250.20.145 TCP 74 443 → 57371 [ACK] Seq=190 Ack=319 Win=8 Len=0 TSval=110912534 TSecr=114443695
  167  24.436356 18.215.66.244 → 10.250.20.145 TCP 74 443 → 57370 [ACK] Seq=190 Ack=319 Win=8 Len=0 TSval=42514103 TSecr=114443695
  168  24.446209 18.215.66.244 → 10.250.20.145 TCP 74 443 → 57388 [ACK] Seq=1214 Ack=320 Win=8 Len=0 TSval=21814211 TSecr=114443695
  169  26.628673 10.250.20.145 → 99.86.80.154 TCP 54 57676 → 443 [ACK] Seq=1 Ack=1 Win=2048 Len=0
  170  26.650411 99.86.80.154 → 10.250.20.145 TCP 74 [TCP ACKed unseen segment] 443 → 57676 [ACK] Seq=1 Ack=2 Win=130 Len=0 TSval=1180469626 TSecr=114355934
  171  26.846140 10.250.20.145 → 131.96.6.237 DNS 100 Standard query 0x03ce A bn2.vortex.data.microsoft.com.akadns.net
  172  26.848699 131.96.6.237 → 10.250.20.145 DNS 537 Standard query response 0x03ce A bn2.vortex.data.microsoft.com.akadns.net A 40.77.226.250 NS a5-130.akagtm.org NS a11-129.akadns.net NS a12-131.akagtm.org NS a7-131.akadns.net NS a18-128.akagtm.org NS a1-128.akadns.net NS a3-129.akadns.net NS a13-130.akagtm.org NS a9-128.akadns.net NS a28-129.akagtm.org A 95.100.173.129 A 2.22.230.130 A 23.61.199.131 A 95.100.168.130 A 193.108.88.128 A 84.53.139.129 A 96.7.49.129 A 95.101.36.128 A 184.85.248.128 A 184.26.160.131 AAAA 2600:1406:32::83
  173  26.849054 10.250.20.145 → 40.77.226.250 TCP 78 57691 → 443 [SYN] Seq=0 Win=65535 Len=0 MSS=1460 WS=64 TSval=114446179 TSecr=0 SACK_PERM=1
  174  26.944407 40.77.226.250 → 10.250.20.145 TCP 82 443 → 57691 [SYN, ACK] Seq=0 Ack=1 Win=8192 Len=0 MSS=1386 WS=256 SACK_PERM=1 TSval=701593845 TSecr=114446179
  175  26.944460 10.250.20.145 → 40.77.226.250 TCP 66 57691 → 443 [ACK] Seq=1 Ack=1 Win=131904 Len=0 TSval=114446273 TSecr=701593845
  176  26.944629 10.250.20.145 → 40.77.226.250 TLSv1 267 Client Hello
  177  27.040219 40.77.226.250 → 10.250.20.145 TCP 1448 [TCP segment of a reassembled PDU]
  178  27.040426 40.77.226.250 → 10.250.20.145 TCP 1448 443 → 57691 [ACK] Seq=1375 Ack=202 Win=262400 Len=1374 TSval=701593938 TSecr=114446273 [TCP segment of a reassembled PDU]
  179  27.040456 10.250.20.145 → 40.77.226.250 TCP 66 57691 → 443 [ACK] Seq=202 Ack=2749 Win=129664 Len=0 TSval=114446368 TSecr=701593938
  180  27.040765 40.77.226.250 → 10.250.20.145 TLSv1.2 964 Server Hello, Certificate, Server Key Exchange, Server Hello Done
  181  27.040787 10.250.20.145 → 40.77.226.250 TCP 66 57691 → 443 [ACK] Seq=202 Ack=3639 Win=130176 Len=0 TSval=114446368 TSecr=701593938
  182  27.041450 10.250.20.145 → 40.77.226.250 TLSv1.2 159 Client Key Exchange, Change Cipher Spec, Encrypted Handshake Message
  183  27.134414 40.77.226.250 → 10.250.20.145 TLSv1.2 125 Change Cipher Spec, Encrypted Handshake Message
  184  27.134463 10.250.20.145 → 40.77.226.250 TCP 66 57691 → 443 [ACK] Seq=295 Ack=3690 Win=131008 Len=0 TSval=114446462 TSecr=701594023
  185  27.135228 10.250.20.145 → 40.77.226.250 TLSv1.2 1062 Application Data, Application Data
  186  27.278133 40.77.226.250 → 10.250.20.145 TCP 74 443 → 57691 [ACK] Seq=3690 Ack=1291 Win=261120 Len=0 TSval=701594179 TSecr=114446462
  187  27.317178 40.77.226.250 → 10.250.20.145 TLSv1.2 388 Application Data
  188  27.317221 10.250.20.145 → 40.77.226.250 TCP 66 57691 → 443 [ACK] Seq=1291 Ack=4005 Win=130752 Len=0 TSval=114446644 TSecr=701594210
  189  27.317602 10.250.20.145 → 40.77.226.250 TLSv1.2 97 Encrypted Alert
  190  27.317660 10.250.20.145 → 40.77.226.250 TCP 66 57691 → 443 [FIN, ACK] Seq=1322 Ack=4005 Win=131072 Len=0 TSval=114446644 TSecr=701594210
  191  27.410910 40.77.226.250 → 10.250.20.145 TCP 74 443 → 57691 [ACK] Seq=4005 Ack=1323 Win=261120 Len=0 TSval=701594313 TSecr=114446644
  192  30.001021 10.250.20.145 → 18.215.66.244 TLSv1.2 129 Application Data
  193  30.038533 18.215.66.244 → 10.250.20.145 TCP 74 443 → 57370 [ACK] Seq=190 Ack=382 Win=8 Len=0 TSval=42515503 TSecr=114449324
  194  30.113587 18.215.66.244 → 10.250.20.145 TLSv1.2 137 Application Data
  195  30.113668 10.250.20.145 → 18.215.66.244 TCP 66 57370 → 443 [ACK] Seq=382 Ack=253 Win=2047 Len=0 TSval=114449436 TSecr=42515522
  196  30.133511 10.250.20.145 → 18.215.66.244 TLSv1.2 129 Application Data
  197  30.162067 18.215.66.244 → 10.250.20.145 TCP 74 443 → 57371 [ACK] Seq=190 Ack=382 Win=8 Len=0 TSval=110913966 TSecr=114449455
  198  30.163732 18.215.66.244 → 10.250.20.145 TLSv1.2 137 Application Data
  199  30.163801 10.250.20.145 → 18.215.66.244 TCP 66 57371 → 443 [ACK] Seq=382 Ack=253 Win=2047 Len=0 TSval=114449484 TSecr=110913966
  200  30.665433  52.96.69.50 → 10.250.20.145 TLSv1.2 97 Application Data
  201  30.665455  52.96.69.50 → 10.250.20.145 TLSv1.2 1153 Application Data
  202  30.665562 10.250.20.145 → 52.96.69.50  TCP 54 57373 → 443 [ACK] Seq=1 Ack=36 Win=4095 Len=0
  203  30.665562 10.250.20.145 → 52.96.69.50  TCP 54 57373 → 443 [ACK] Seq=1 Ack=1127 Win=4078 Len=0
  204  30.665721  52.96.69.50 → 10.250.20.145 TLSv1.2 97 Application Data
  205  30.665784 10.250.20.145 → 52.96.69.50  TCP 54 57373 → 443 [ACK] Seq=1 Ack=1162 Win=4095 Len=0
  206  30.720065 10.250.20.145 → 18.215.66.244 TLSv1.2 129 Application Data
  207  30.765454 18.215.66.244 → 10.250.20.145 TCP 74 443 → 57382 [ACK] Seq=190 Ack=383 Win=8 Len=0 TSval=77618369 TSecr=114450039
  208  30.765477 18.215.66.244 → 10.250.20.145 TLSv1.2 137 Application Data
  209  30.765583 10.250.20.145 → 18.215.66.244 TCP 66 57382 → 443 [ACK] Seq=383 Ack=253 Win=2047 Len=0 TSval=114450084 TSecr=77618370
  210  30.852393 10.250.20.145 → 18.215.66.244 TLSv1.2 129 Application Data
  211  30.879245 18.215.66.244 → 10.250.20.145 TCP 74 443 → 57384 [ACK] Seq=1216 Ack=383 Win=8 Len=0 TSval=42515713 TSecr=114450170
  212  30.880452 18.215.66.244 → 10.250.20.145 TLSv1.2 137 Application Data
  213  30.880551 10.250.20.145 → 18.215.66.244 TCP 66 57384 → 443 [ACK] Seq=383 Ack=1279 Win=2047 Len=0 TSval=114450197 TSecr=42515714
  214  30.995667 10.250.20.145 → 18.215.66.244 TLSv1.2 129 Application Data
  215  31.025239 18.215.66.244 → 10.250.20.145 TCP 74 443 → 57385 [ACK] Seq=190 Ack=383 Win=8 Len=0 TSval=98312065 TSecr=114450308
  216  31.027153 18.215.66.244 → 10.250.20.145 TLSv1.2 137 Application Data
  217  31.027249 10.250.20.145 → 18.215.66.244 TCP 66 57385 → 443 [ACK] Seq=383 Ack=253 Win=2047 Len=0 TSval=114450338 TSecr=98312065
  218  31.127583 10.250.20.145 → 18.215.66.244 TLSv1.2 129 Application Data
  219  31.154504 18.215.66.244 → 10.250.20.145 TCP 74 443 → 57386 [ACK] Seq=1216 Ack=383 Win=8 Len=0 TSval=42515782 TSecr=114450438
  220  31.155179 18.215.66.244 → 10.250.20.145 TLSv1.2 137 Application Data
  221  31.155221 10.250.20.145 → 18.215.66.244 TCP 66 57386 → 443 [ACK] Seq=383 Ack=1279 Win=2047 Len=0 TSval=114450465 TSecr=42515782
  222  31.269570 10.250.20.145 → 18.215.66.244 TLSv1.2 129 Application Data
  223  31.299295 18.215.66.244 → 10.250.20.145 TCP 74 443 → 57387 [ACK] Seq=190 Ack=383 Win=9 Len=0 TSval=76715361 TSecr=114450579
  224  31.300616 18.215.66.244 → 10.250.20.145 TLSv1.2 137 Application Data
  225  31.300723 10.250.20.145 → 18.215.66.244 TCP 66 57387 → 443 [ACK] Seq=383 Ack=253 Win=2047 Len=0 TSval=114450609 TSecr=76715362
  226  31.401678 10.250.20.145 → 18.215.66.244 TLSv1.2 129 Application Data
  227  31.442986 18.215.66.244 → 10.250.20.145 TCP 74 443 → 57388 [ACK] Seq=1214 Ack=383 Win=8 Len=0 TSval=21815960 TSecr=114450709
  228  31.444225 18.215.66.244 → 10.250.20.145 TLSv1.2 137 Application Data
  229  31.444326 10.250.20.145 → 18.215.66.244 TCP 66 57388 → 443 [ACK] Seq=383 Ack=1277 Win=2047 Len=0 TSval=114450751 TSecr=21815960
